name,has_test,address,created_at,insider_interview,alternate_url,employer,schedule,accept_temporary,professional_roles,experience,employment,salary_from,salary_to,requirement,responsibility
Python-разработчик,False,Екатеринбург,2024-07-10 11:39,null,https://hh.ru/vacancy/103641114,Теропром,"{'id': 'fullDay', 'name': 'Полный день'}",False,"Программист, разработчик",Нет опыта,Полная занятость,50000,150000,Знание основ Git. Знание основ <highlighttext>ETL</highlighttext>. Будут плюсом: навыки <highlighttext>разработки</highlighttext> баз данных. Умение находить нетривиальные решения. Умение самостоятельно определять сроки...,"Автоматизация бизнес-процессов через API различных маркетплейсов (OZON, WB, Яндекс Маркет). Заниматься построением связей с данными парсинга поставщиков и маркетплейсами. "
Младший разработчик,True,Москва,2024-06-22 14:11,null,https://hh.ru/vacancy/85002915,GlowByte,"{'id': 'flexible', 'name': 'Гибкий график'}",False,"Программист, разработчик",Нет опыта,Полная занятость,null,null,Обязательные: Высшее IT/техническое образование либо последние курсы государственного технического ВУЗа. Базовое понимание физической модели данных одной из промышленных БД. ,Участие в реализации корпоративных информационно-аналитических систем (DWH/<highlighttext>ETL</highlighttext>/BI) в качестве <highlighttext>разработчика</highlighttext>. Участие в проектировании процессов загрузки данных Extract...
Архитектор IT (удаленнно),False,null,2024-06-24 11:46,"{'id': '31607', 'url': 'https://hh.ru/interview/31607?employerId=2406247'}",https://hh.ru/vacancy/101926192,Selecty,"{'id': 'remote', 'name': 'Удаленная работа'}",False,Руководитель группы разработки,От 3 до 6 лет,Полная занятость,null,null,"Опыт построения интеграционных решений (SOA, микросервисы, <highlighttext>ETL</highlighttext>). Понимание особенностей <highlighttext>разработки</highlighttext> виртуализируемых высоконагруженных, территориально-распределенных систем. Опыт работы с Docker & Kubernetes. ",Проектирование технических решений по реализации бизнес и функциональных требований. Изучать влияние предлагаемых изменений на существующие процессы и интеграции. 
Дата инженер / Разработчик ETL,False,null,2024-06-21 14:47,null,https://hh.ru/vacancy/102438836,Overtech Consulting Group,"{'id': 'remote', 'name': 'Удаленная работа'}",True,"Программист, разработчик",От 1 года до 3 лет,Полная занятость,null,null,"Понимание технологий стека Hadoop (Hive, Hbase, Spark, Kafka, Greenplum, Teradata, SAS DI и др.). Знание принципов, опыт проектирования с использованием...","Разработка/настройка инфраструктуры. Разработка функциональности обработки больших объемов данных с использованием стека технологий Big Data (Hadoop, Spark, Hive, HBase). "
Аналитик данных,False,null,2024-07-11 10:23,null,https://hh.ru/vacancy/103693197,Axenix (ранее Accenture),"{'id': 'fullDay', 'name': 'Полный день'}",False,"BI-аналитик, аналитик данных",От 1 года до 3 лет,Полная занятость,null,null,...этой базы данных). Глубокое понимание языка SQL. Работа с Airflow. Знание Python (база). Опыт работы <highlighttext>ETL</highlighttext>-<highlighttext>разработчиком</highlighttext> на проектах DWH.,Настройка ETL-процессов для системы интегрированного планирования. Анализом и оптимизацией выполнения запросов для улучшения производительности и снижения нагрузки на базу...
Аналитик,False,null,2024-06-20 12:45,null,https://hh.ru/vacancy/91135894,Лига Цифровой Экономики,"{'id': 'fullDay', 'name': 'Полный день'}",False,Системный аналитик,От 1 года до 3 лет,Полная занятость,null,null,"Умение выстраивать конструктивные коммуникации с Заказчиком, желание разобраться в его потребностях. Навык оформления полученной информации в документацию. Опыт написания функциональных...","Погружаться в бизнес деятельность Банка, практически во все области. Исследовать предметную область, проектировать и согласовывать процесс to-be. "
Аналитик-разработчик,False,Москва,2024-07-08 11:01,null,https://hh.ru/vacancy/103486332,Ozon,"{'id': 'fullDay', 'name': 'Полный день'}",False,Аналитик,От 1 года до 3 лет,Полная занятость,null,null,"Высшее образование (математическое, экономическое). Опыт работы в роли аналитика/математика/разработчика (от года). Опыт в выстраивании аналитической базы и планирования. ","Разработка <highlighttext>ETL</highlighttext>-пайплайнов с помощью SQL. <highlighttext>Разработка</highlighttext> ML-пайплайнов обучения моделей (scikit-learn, LightGBM, XGBoost, CatBoost). Анализ динамики метрик эффективности..."
ETL разработчик,False,null,2024-07-11 11:34,null,https://hh.ru/vacancy/103316604,Robusta,"{'id': 'remote', 'name': 'Удаленная работа'}",False,Другое,От 1 года до 3 лет,Полная занятость,null,null,Конвертация кода SQL из диалекта MsSQL на Greenplum. SQL. Greenplum. MSSQL.,
Разработчик отдела разработки BI,False,null,2024-07-10 17:04,null,https://hh.ru/vacancy/103669755,Finbridge,"{'id': 'remote', 'name': 'Удаленная работа'}",False,"Программист, разработчик",От 1 года до 3 лет,Полная занятость,null,null,"Уверенное знание ANSI SQL, T-SQL – от 1 года. Опыт написания и оптимизации SQL запросов – от 1 года, чтение и...",Анализ производительности кода и его оптимизация. Участие в разработке <highlighttext>ETL</highlighttext>-процессов. <highlighttext>Разработка</highlighttext> механизмов миграции данных между слоями системы DWH. 
Middle Data Engineer,False,null,2024-07-11 07:26,null,https://hh.ru/vacancy/103681840,FESCO (ПАО Дальневосточное морское пароходство),"{'id': 'remote', 'name': 'Удаленная работа'}",False,Дата-сайентист,От 3 до 6 лет,Полная занятость,240000,,Опыт построения аналитического хранилища данных. Опыт моделирования данных (разные слои данных). Уверенное знание Python. Углубленное знание SQL. Комплексное понимание архитектуры...,"Реализация, организация и поддержка объектов на всех слоях хранилища. Разработка <highlighttext>ETL</highlighttext>-пайплайнов. <highlighttext>Разработка</highlighttext> и доработка интеграционных элементов, коннекторов, внутренних сервисов. "
Data Engineer,False,null,2024-07-01 20:22,null,https://hh.ru/vacancy/103080324,Т1,"{'id': 'fullDay', 'name': 'Полный день'}",False,Дата-сайентист,От 3 до 6 лет,Полная занятость,null,null,"Уверенное знание SQL: сложные запросы, аналитически функции, понимание физической реализации join’ов, оптимизация производительности запросов, хранимые процедуры и функции. ","...а также подготовка требований для разработки промышленных <highlighttext>ETL</highlighttext>-процессов. Контроль качества загружаемых данных, <highlighttext>разработка</highlighttext> автоматизированных инструментов для оценки качества данных. "
Разработчик SQL,False,Москва,2024-07-01 09:35,null,https://hh.ru/vacancy/101340347,ИТС,"{'id': 'remote', 'name': 'Удаленная работа'}",False,"Программист, разработчик",От 1 года до 3 лет,Полная занятость,null,null,"Технологичиский стек: SQL Server, SSAS tabular, SSRS, SSIS. Уверенное владение языками SQL/T-SQL и DAX. Желателен опыт работы с...","...аналитической отчетности, включая: Проектирование ETL. Оптимизация существующих хранимых процедур. Поддержка и развитие <highlighttext>ETL</highlighttext>-решений на базе SSIS. <highlighttext>Разработка</highlighttext> проектной документации."
ETL-разработчик (Data Engineer),False,null,2024-07-03 16:24,null,https://hh.ru/vacancy/81864083,СберСпасибо,"{'id': 'fullDay', 'name': 'Полный день'}",False,"Программист, разработчик",От 1 года до 3 лет,Полная занятость,null,null,"Уверенные знания Python и SQL. Опыт работы с: Промышленными ETL (DBT как преимущество, SAS DI, Informatica, ODI, DataStage). ",Настроить пайплайн автоматической проверки качества данных. Написать скрипты для загрузки новых источников. Создать витрины для команды розницы и product analysis. 
"Разработчик ETL/DWH/DB, Разработчик Баз данных",False,Москва,2024-06-25 19:17,null,https://hh.ru/vacancy/102716548,Интеллектуальные решения,"{'id': 'fullDay', 'name': 'Полный день'}",False,"Программист, разработчик",От 3 до 6 лет,Полная занятость,,360000,"Компания «Интеллектуальные решения» занимается разработкой и внедрением решений в области ИТ и Digital в крупнейших российских компаниях, а также активно...",Мы находимся в поиске инженера данных (middle +) для реализации следующих задач: ‒ Разработка ETL-процессов для структурированных и слабоструктурированных данных...
Python developer middle+ \senior (Airflow),False,Москва,2024-06-20 12:47,null,https://hh.ru/vacancy/102352142,«Баланс-Платформа»,"{'id': 'fullDay', 'name': 'Полный день'}",False,"Программист, разработчик",От 3 до 6 лет,Полная занятость,null,null,Опыт работы в роли Python Developer от 3-х лет. Опыт работы с реляционными СУБД: SQLAlchemy / Alembic / DjangoORM / SQL / PostgreSQL. ,Разработка российского ПО класса mission critical (сервиса управления бизнес-процессами (BPM) для лидеров финансового сектора на языке Python 3.9...
Аналитик Power BI,False,null,2024-07-01 16:23,null,https://hh.ru/vacancy/103066697,GlobalCareer,"{'id': 'remote', 'name': 'Удаленная работа'}",False,"BI-аналитик, аналитик данных",От 1 года до 3 лет,Полная занятость,null,null,...MS Power BI. Знание российских аналогов BI cистем и их функциональных возможностей. Опыт разработки <highlighttext>ETL</highlighttext>-процессов. Опыт <highlighttext>разработки</highlighttext> на Python.,"Администрирование Power BI, создание отчетов и их изменение. Анализ и оценка доработок системы. Тестирование доработок. Анализ массивов данных. "
Дата-инженер,False,null,2024-07-08 15:31,"{'id': '32978', 'url': 'https://hh.ru/interview/32978?employerId=78638'}",https://hh.ru/vacancy/103517126,Т-Банк,"{'id': 'flexible', 'name': 'Гибкий график'}",False,"Программист, разработчик",От 3 до 6 лет,Полная занятость,null,null,Опыт работы с базами данных в качестве аналитика/разработчика от 2 лет. Опыт участия в проектах по созданию и развитию...,Системный анализ источников данных и интеграций. Системный анализ процессов работы и взаимодействия компонент платформы. Участие в формировании модели данных. 
Разработчик DWH,False,null,2024-06-18 16:48,null,https://hh.ru/vacancy/99598796,Ростелеком,"{'id': 'remote', 'name': 'Удаленная работа'}",False,"BI-аналитик, аналитик данных",Нет опыта,Полная занятость,,60000,"PostgreSQL, PL\SQL, SQL. Знания Python, GreenPlum и Data Vault 2.0 приветствуются.","<highlighttext>ETL</highlighttext>-<highlighttext>разработка</highlighttext> (DataStage, сценарии и подписки), пересчёт данных в витрине, разработка тех.решений хранения данных в БД, оптимизация запросов, анализ данных."
Дата инженер / Data Engineer (Сбережения),False,null,2024-07-04 12:08,null,https://hh.ru/vacancy/103283039,СБЕР,"{'id': 'fullDay', 'name': 'Полный день'}",False,Аналитик,От 1 года до 3 лет,Полная занятость,null,null,"Опыт работы в качестве Data Engineer / Data Analyst / <highlighttext>ETL</highlighttext> <highlighttext>Developer</highlighttext>. Знание SQL на продвинутом уровне (аналитические функции, подзапросы, хранимые процедуры...",Проектирование и разработка аналитических витрин данных для целей отчетности на стеке технологий Hadoop + Spark. Мониторинг и оптимизация процессов сборки...
Программист-разработчик,False,Белгород,2024-07-10 11:46,null,https://hh.ru/vacancy/103641839,"Мираторг, Агропромышленный холдинг","{'id': 'fullDay', 'name': 'Полный день'}",False,"Программист, разработчик",От 3 до 6 лет,Полная занятость,null,null,"...с MS SQL или Oracle (PL/SQL). Опыт работы с <highlighttext>ETL</highlighttext>-инструментами. Опыт в <highlighttext>разработке</highlighttext> OLAP-кубов, знание языка MDX.",Написание нового и изменение существующего программного кода. Разработка и реализация процедур обмена данными между системами. Функциональное тестирование разработанных модулей. 
Data engineer (ETL-разработчик)_У,False,null,2024-06-14 11:52,null,https://hh.ru/vacancy/101924597,СБЕР,"{'id': 'fullDay', 'name': 'Полный день'}",False,Аналитик,От 1 года до 3 лет,Полная занятость,null,null,Знание моделей и структур проектирования баз данных. Уверенное владение SQL. Базовые знания Python. Понимание процессов загрузки и обработки данных (ETL...,Создание и оптимизация пайплайнов для сбора и обработки данных. Контроль качества и актуальности данных в DWH. Автоматизация построения витрин данных. 
Разработчик баз данных,False,Москва,2024-06-19 19:29,null,https://hh.ru/vacancy/102305313,"МАГНИТ, Розничная сеть","{'id': 'fullDay', 'name': 'Полный день'}",False,"Программист, разработчик",От 3 до 6 лет,Полная занятость,null,null,"Опыт разработки на PostgreSQL от 3-х лет, желательно разработка на ClickHouse. Опыт выявления проблем производительности функциональности БД и оптимизации...","Разработка/поддержка БД-части PostgreSQL, ClickHouse для web-системы. Развитие архитектуры для работы с большими объемами данных. Взаимодействие с командой..."
Аналитик данных,False,Москва,2024-07-04 19:57,null,https://hh.ru/vacancy/103316160,РСХБ-Интех,"{'id': 'fullDay', 'name': 'Полный день'}",False,"BI-аналитик, аналитик данных",От 1 года до 3 лет,Полная занятость,null,null,Знание Informatica Power Center или других <highlighttext>ETL</highlighttext>/ELT средств. Опыт <highlighttext>разработки</highlighttext> документации (BRD/FSD) по отчетности на хранилище данных. ,"Подготовка технического задания для <highlighttext>ETL</highlighttext>-<highlighttext>разработчика</highlighttext>. Подготовка карт отображения ""источник-приемник"", описание взаимодействия информационных систем, участие в проектировании модели данных. "
Инженер данных,False,Пермь,2024-07-02 07:57,null,https://hh.ru/vacancy/103099170,НВ-АСУпроект,"{'id': 'fullDay', 'name': 'Полный день'}",False,"BI-аналитик, аналитик данных",От 1 года до 3 лет,Полная занятость,null,null,"Высшее техническое IT-образование. Рассмотрим вариант неоконченного Высшего образования. Знания по СУБД Postgres/Oracle/SAP Hana, использующейся для реализации корпоративного...",Разработка и техническое сопровождение приложений на PL\SQL. Обеспечение работоспособности и производительности БД системы. Разработка и поддержка механизмов интеграции между...
ETL-разработчик,False,Москва,2024-07-08 13:29,null,https://hh.ru/vacancy/103503305,М.Видео-Эльдорадо,"{'id': 'fullDay', 'name': 'Полный день'}",False,"BI-аналитик, аналитик данных",От 3 до 6 лет,Полная занятость,null,null,"Опыт работы в качестве разработчика на промышленной СУБД (Oracle, MS SQL, Postgres). Знание SQL на высоком уровне. Опыт оптимизации SQL...","Проектирование, разработка объектов аналитического хранилища данных (АХД) на базе СУБД Greenplum, Clickhouse. Проектирование, разработка потоков загрузки данных в АХД с..."
ETL разработчик,False,null,2024-07-09 13:12,null,https://hh.ru/vacancy/103587295,Т1,"{'id': 'fullDay', 'name': 'Полный день'}",False,"Программист, разработчик",От 1 года до 3 лет,Полная занятость,null,null,Разрабатывать типовые потоки в IPC и IDQ. Какие знания и навыки для нас важны: Опыт работы разработчиком на проектах формирования...,Создавать Python скрипты для загрузки данных. Сопровождать и развивать БД ArenaData DB. Мониторить корректность сборки витрин данных. Настраивать натификации из...
Data Analyst,False,null,2024-06-24 11:48,null,https://hh.ru/vacancy/100496608,СБЕР,"{'id': 'fullDay', 'name': 'Полный день'}",False,"Программист, разработчик",От 1 года до 3 лет,Полная занятость,null,null,"Разбираешься в Excel. Умеешь разрабатывать <highlighttext>ETL</highlighttext>-процессы. Имеешь опыт <highlighttext>разработки</highlighttext> на Java. Имеешь опыт работы с Jira, Git,Confluence, Wiki. ",Разрабатывать процессы поставки данных. Разрабатывать python+sql скрипты для выгрузки и обработки данных для построения витрин. Анализировать действующие скрипты sql+python на...
Архитектор платформы данных,False,null,2024-06-13 12:59,null,https://hh.ru/vacancy/98922297,Т1,"{'id': 'fullDay', 'name': 'Полный день'}",False,Архитектор,От 3 до 6 лет,Полная занятость,null,null,"Опыт работы с инструментами и подходами бизнес-аналитики, reporting & dashboarding. - Опыт разработки <highlighttext>ETL</highlighttext>, ELT. - Опыт <highlighttext>разработки</highlighttext> методов и процедур для...",Курирование процессов миграции продуктовых система со стороны хранилища данных. - Разработка функциональной архитектуры корпоративного хранилища данных. - Участие в разработке архитектуры миграций. - 
Аналитик,False,Санкт-Петербург,2024-07-04 11:00,null,https://hh.ru/vacancy/103276522,СПБ ГБУ ИМЦ,"{'id': 'fullDay', 'name': 'Полный день'}",False,Аналитик,От 1 года до 3 лет,Полная занятость,70000,,"Знание реляционной модели данных. Опыт работы с СУБД (Oracle, MySQL или PostgreSQL). Английский язык на уровне чтения технической документации. ","Разработка и доработка существующих <highlighttext>ETL</highlighttext>-процессов (Pentaho Data Integration). <highlighttext>Разработка</highlighttext> и доработка существующих отчетов автоматизированной информационной системы (Eclipse Birt, SQL). "
