name,has_test,address,created_at,insider_interview,alternate_url,employer,schedule,accept_temporary,professional_roles,experience,employment,salary_from,salary_to,requirement,responsibility
ETL- разработчик,False,Москва,2024-06-17 22:57,null,https://hh.ru/vacancy/97647119,Центральный банк Российской Федерации,"{'id': 'fullDay', 'name': 'Полный день'}",False,"Программист, разработчик",От 3 до 6 лет,Полная занятость,null,null,высшее образование (техническое или экономическое). - релевантный опыт не менее 3х лет. - разработка структур и ETL процедур для заполнения хранилища...,"ДИТ формирует ИТ-политику Банка России, систематизирует все изменения и инициативы в этом направлении, а Центр развития ДИТ реализует проекты..."
Тестировщик ETL/DWH,False,null,2024-07-02 12:09,null,https://hh.ru/vacancy/101442107,Лига Цифровой Экономики,"{'id': 'remote', 'name': 'Удаленная работа'}",False,Тестировщик,От 1 года до 3 лет,Полная занятость,null,null,Высшее техническое образование (предпочтительно в сфере IT). Умение составлять SQL запросы и работать с СУБД. Знания о различных видах тестирования...,"Понимание работы тестируемого функционала (SQL/PLSQL-запросы разной сложности, <highlighttext>ETL</highlighttext>-инструменты). <highlighttext>Разработка</highlighttext> тест-кейсов (написание новых проверок, актуализация существующих). "
Data-инженер,False,null,2024-07-09 07:27,"{'id': '32978', 'url': 'https://hh.ru/interview/32978?employerId=78638'}",https://hh.ru/vacancy/94207100,Т-Банк,"{'id': 'fullDay', 'name': 'Полный день'}",False,"Программист, разработчик",От 3 до 6 лет,Полная занятость,null,null,Свободно владеете SQL. Работали с базами данных в качестве аналитика или разработчика минимум 2 года. Понимаете теорию СУБД- и ETL...,Участвовать в формировании модели данных. Проектировать и разрабатывать витрины и потоки данных на основе потребностей бизнес-пользователей. Участвовать в проектах...
Business Data Engineer,False,null,2024-07-02 18:23,"{'id': '32978', 'url': 'https://hh.ru/interview/32978?employerId=78638'}",https://hh.ru/vacancy/81719749,Т-Банк,"{'id': 'remote', 'name': 'Удаленная работа'}",False,"Программист, разработчик",От 3 до 6 лет,Полная занятость,null,null,Высшее техническое образование. Опыт работы с базами данных в качестве разработчика от 1 года. Свободное владение SQL. Опыт проектирования объектов...,"Быть экспертом по данным: помогать аналитикам в решении вопросов с источниками данных, моделью данных DWH. Разрабатывать витрины в помощь аналитикам. "
"Аналитик данных DWH, ETL",True,Москва,2024-06-17 10:03,null,https://hh.ru/vacancy/102071027,Московская Биржа,"{'id': 'fullDay', 'name': 'Полный день'}",False,"BI-аналитик, аналитик данных",От 3 до 6 лет,Полная занятость,null,null,Опыт работы системным аналитиком DWH и аналитической отчетности – от 3 лет. Знание и опыт проектирования реляционных моделей данных – от 3...,"Мы храним в депозитарии цифровые записи о каждом активе, который торгуется на бирже. Мы следим за тем, чтобы все операции..."
Главный аналитик (Розничного инвестиционного бизнеса),False,Москва,2024-06-24 13:27,"{'id': '32631', 'url': 'https://hh.ru/interview/32631?employerId=80'}",https://hh.ru/vacancy/102591593,Альфа-Банк,"{'id': 'fullDay', 'name': 'Полный день'}",False,Другое,От 3 до 6 лет,Полная занятость,null,null,"Опыт разработки и сопровождения <highlighttext>ETL</highlighttext> процессов, владение одним из средств <highlighttext>разработки</highlighttext> ETL процессов. Создания отчетных и аналитических форм. ","Формировать регулярную аналитику по инвестиционному бизнесу: клиентская аналитика, продуктовая аналитика в разрезе каналов/сегментов, контроль и анализ KPI, факторный анализ..."
Data-инженер,False,Ростов-на-Дону,2024-07-08 11:35,"{'id': '32978', 'url': 'https://hh.ru/interview/32978?employerId=78638'}",https://hh.ru/vacancy/98960058,Т-Банк,"{'id': 'fullDay', 'name': 'Полный день'}",False,"Программист, разработчик",От 3 до 6 лет,Полная занятость,null,null,Свободно владеете SQL. Работали с базами данных в качестве аналитика или разработчика минимум 2 года. Понимаете теорию СУБД- и ETL...,Участвовать в формировании модели данных. Проектировать и разрабатывать витрины и потоки данных на основе потребностей бизнес-пользователей. Участвовать в проектах...
Старший разработчик DWH,False,null,2024-07-09 12:51,null,https://hh.ru/vacancy/102858079,ЭР-Телеком,"{'id': 'remote', 'name': 'Удаленная работа'}",False,"Программист, разработчик",От 1 года до 3 лет,Полная занятость,null,null,"Умение проектировать базы данных. Знание OLAP- технологий. Знание современных технологий обработки данных и методологий построения DWH, процессов в области управления...","Разработка и поддержка текущих <highlighttext>ETL</highlighttext>-процессов сбора данных, <highlighttext>разработка</highlighttext> проверок качества данных, интеграция новых источников. Определение возможностей для автоматизации и..."
Аналитик DWH,False,null,2024-07-03 15:36,null,https://hh.ru/vacancy/103229247,Т1,"{'id': 'fullDay', 'name': 'Полный день'}",False,Системный аналитик,От 1 года до 3 лет,Полная занятость,null,null,Опыт работы с технологией BigData или кластером Hadoop желателен. От вас потребуется: Высшее техническое образование. Опыт работы в роли системного...,"верифицировать исходные данные и полученные результаты <highlighttext>ETL</highlighttext> обработки, участвовать в <highlighttext>разработке</highlighttext> алгоритмов для вспомогательных сервисов (автоматизированный контроль данных, визуализация результатов..."
Аналитик данных (middle),False,Москва,2024-07-03 10:25,null,https://hh.ru/vacancy/103195749,Электронная торговая площадка Газпромбанка,"{'id': 'fullDay', 'name': 'Полный день'}",False,"BI-аналитик, аналитик данных",От 3 до 6 лет,Полная занятость,null,null,Опыт работы от 2 лет в области анализа данных и работы с хранилищами данных. Опыт формирования и анализа больших массивов...,Проектировать модель данных и витрины данных. Разработка и поддержка <highlighttext>ETL</highlighttext>-процессов. <highlighttext>Разработка</highlighttext> и поддержка отчетов и дашбордов для анализа данных. 
DWH разработчик,False,Москва,2024-06-19 15:26,null,https://hh.ru/vacancy/102288268,АО «ОТП Банк» (JSC «OTP Bank»),"{'id': 'fullDay', 'name': 'Полный день'}",False,"Программист, разработчик",От 1 года до 3 лет,Полная занятость,null,null,Опыт работы на проектах по развитию Хранилищ Данных (DWH) или Data-решений от 2-х лет. Опыт <highlighttext>ETL</highlighttext>/ELT <highlighttext>разработки</highlighttext>...,"Развитие и сопровождение ETL/ELT процессов. Взаимодействие с внутренними заказчиками, системными аналитиками-экспертами других подразделений. Мониторинг загрузки данных. "
Младший системный аналитик (DWH),False,null,2024-06-18 18:57,null,https://hh.ru/vacancy/100122874,Mediascope,"{'id': 'fullDay', 'name': 'Полный день'}",False,"BI-аналитик, аналитик данных",От 1 года до 3 лет,Полная занятость,null,null,Владеть навыками написание запросов на SQL или знать язык программирования Python на хорошем уровне. Опыт работы с DWH будет плюсом.,"Проводить финальную проверку корректности работы <highlighttext>ETL</highlighttext>-процессов после того, как <highlighttext>разработка</highlighttext> реализует их. Формировать качественные и количественные характеристики для оценки..."
Ведущий разработчик ETL / DWH,False,Москва,2024-07-05 12:03,null,https://hh.ru/vacancy/102378603,СК «Росгосстрах Жизнь»,"{'id': 'fullDay', 'name': 'Полный день'}",False,"Программист, разработчик",От 1 года до 3 лет,Полная занятость,null,null,"Опыт работы с одной из СУБД: MS SQL Server, PostgreSQL. Опыт разработки корпоративных приложений;. Хороший уровень знания TSQL/PgSQL. ","Участие в разработке интеграций в DWH из различных источников с помощью инструментов <highlighttext>ETL</highlighttext>(<highlighttext>ETL</highlighttext> Pentaho, SSIS). Участие в <highlighttext>разработке</highlighttext> отчётов..."
Data engineer (ETL),False,null,2024-07-11 12:51,null,https://hh.ru/vacancy/90484977,Тера Интегро,"{'id': 'fullDay', 'name': 'Полный день'}",False,"Программист, разработчик",От 3 до 6 лет,Полная занятость,null,null,"Опыт работы с MMP платформами (Greenplum, Teradata). Хорошие знания в SQL (PostgreSQL). Опыт использования ETL (Informatica, SAS DI, SSIS, NiFi...",Разработка/доработка ETL процессов. Проектирование новых ETL решений. Тестирование и внедрение ETL процессов.
Разработчик SharePoint,False,null,2024-07-10 11:32,null,https://hh.ru/vacancy/94218189,Т1,"{'id': 'remote', 'name': 'Удаленная работа'}",False,"Программист, разработчик",От 3 до 6 лет,Полная занятость,null,null,Опыт разработки отчётов на базе MS Reporting Services. Опыт разработки хранилищ данных и <highlighttext>ETL</highlighttext> процессов. Опыт проектирования и <highlighttext>разработки</highlighttext> аналитических...,Разрабатывать функциональные модули для MS Project Server 2019/SharePoint 2019. Разрабатывать отчётность на базе MS SQL Server Reporting Services. 
Data Engineer,False,Москва,2024-06-28 19:08,null,https://hh.ru/vacancy/97151233,Национальная система платежных карт,"{'id': 'fullDay', 'name': 'Полный день'}",False,Другое,От 3 до 6 лет,Полная занятость,null,null,"Знание компонентов экосистемы Hadoop (Spark, Hive, Impala, Hbase). Опыт работы с ClickHouse, PostgreSQL. Понимание принципов работы Kafka. Знание SQL, Python...","Сопровождение и развитие платформы данных. Запуск и сопровождение <highlighttext>ETL</highlighttext> процессов, конвейеров данных. <highlighttext>Разработка</highlighttext> и сопровождение CI/CD конвейеров. "
Enterprise Architect,False,Москва,2024-07-11 11:58,null,https://hh.ru/vacancy/96746334,РАСЧЕТНЫЕ РЕШЕНИЯ,"{'id': 'remote', 'name': 'Удаленная работа'}",False,Другое,От 1 года до 3 лет,Полная занятость,null,null,"знание принципов построения интеграционного слоя (SOA, <highlighttext>ETL</highlighttext>/ELT, API management). ∙ опыт <highlighttext>разработки</highlighttext> ТЗ на интеграцию со смежными системами. ∙ ","оценка бизнес, solution-инициатив на соответствие целевой ит-архитектуре компании. ∙ разработка концептуальной архитектуры продуктов на основании бизнес-требований и архитектурных..."
Ведущий разработчик DWH,True,null,2024-07-10 13:54,null,https://hh.ru/vacancy/95264454,БУРГЕР КИНГ РОССИЯ,"{'id': 'remote', 'name': 'Удаленная работа'}",False,"Программист, разработчик",От 3 до 6 лет,Полная занятость,null,null,"Высокий уровень владения SQL (умение оптимизировать запросы, чтение плана запроса; разработка хранимых процедур на PL/pgSQL; написание динамических SQL-запросов...","Разработка, оптимизация скриптов, представлении, хранимых процедур DWH. Реализация и развитие <highlighttext>ETL</highlighttext> процессов. Оптимизация, <highlighttext>разработка</highlighttext> потоков данных в DWH и из..."
ETL разработчик,False,null,2024-07-02 11:17,null,https://hh.ru/vacancy/103119101,ITFB Group,"{'id': 'fullDay', 'name': 'Полный день'}",False,"Программист, разработчик",От 3 до 6 лет,Полная занятость,null,null,"Опыт разработки хранилищ от 3 лет на аналогичной позиции. ​​​​Опыт разработки SQL/ETL, потоков загрузки данных. Python, SQL, Airflow, Arenadata...","Проектирование, разработка, тестирование и внедрение ETL процессов с использованием SQL, конвейера данных и ETL Framework."
Data Engineer,False,Самара,2024-06-19 11:12,"{'id': '32978', 'url': 'https://hh.ru/interview/32978?employerId=78638'}",https://hh.ru/vacancy/99556623,Т-Банк,"{'id': 'fullDay', 'name': 'Полный день'}",False,"Программист, разработчик",От 3 до 6 лет,Полная занятость,null,null,"Высшее техническое образование. Опыт работы с базами данных в качестве разработчика от 1 года. Свободное владение SQL, знание основ python. ","Greenplum / Hadoop / Clickhouse в качестве ядра обработки данных. Собственные решения на базе Apache Airflow, Apache NiFi Apache Flink в качестве..."
Data Engineer (ETL Developer),False,Санкт-Петербург,2024-07-09 11:37,null,https://hh.ru/vacancy/93274421,Lesta Games,"{'id': 'fullDay', 'name': 'Полный день'}",False,"BI-аналитик, аналитик данных",От 3 до 6 лет,Полная занятость,null,null,"Опыт работы <highlighttext>ETL</highlighttext>-<highlighttext>разработчика</highlighttext>/инженера по работе с данными от 3х лет. Опыт работы со Spark, Scala/Python. ","Создавать средства взаимодействия с источниками данных, поддерживать используемые сторонние коннекторы. Имплементировать логику ETL-трансформаций на Spark, PL/SQL, Hive, Impala. "
Аналитик 1С,False,Москва,2024-06-18 12:48,null,https://hh.ru/vacancy/102185393,MIXIT,"{'id': 'fullDay', 'name': 'Полный день'}",False,Аналитик,От 1 года до 3 лет,Полная занятость,null,null,"...1С и обучения пользователей. Описание интеграций, нотации, спецификации интерфейсов. Опыт анализа/разработки <highlighttext>ETL</highlighttext>-процессов. Понимание принципов ведения промышленной <highlighttext>разработки</highlighttext>.",Взаимодействовать с бизнес-заказчиками для фиксации и согласования бизнес-требований. Формировать ТЗ для разработчиков 1С. Проводить тестирование изменений в...
Разработчик по автоматизации процессов,False,null,2024-06-25 09:30,null,https://hh.ru/vacancy/91846121,АйСи Инвест,"{'id': 'fullDay', 'name': 'Полный день'}",False,Специалист службы безопасности,От 3 до 6 лет,Полная занятость,null,null,Наличие высшего образования (информационные технологии). Опыт работы Data Engineer не менее 3 лет. Опыт создания инструментов и сервисов по направлениям...,"Извлечение, преобразование, загрузка данных и их обработка, <highlighttext>ETL</highlighttext>/ELT (Python/Airflow). <highlighttext>Разработка</highlighttext> систем для автоматического анализа данных и формирования результирующей..."
Архитектор интеграционной модели данных,True,Москва,2024-07-04 16:31,null,https://hh.ru/vacancy/103306266,ПСБ (ПАО «Промсвязьбанк»),"{'id': 'fullDay', 'name': 'Полный день'}",False,Архитектор,От 1 года до 3 лет,Полная занятость,null,null,"Знание и опыт разработки \ оптимизации <highlighttext>ETL</highlighttext> процессов. Опыт <highlighttext>разработки</highlighttext> промышленного ETL на одном из инструментов (Informatica, SAS DI, Oracle DI...","Построение интеграции данных для разнородных источников, в том числе для учета историчности, анализа real-time событий и др. "
Разработчик Arenadata,False,null,2024-06-19 16:35,null,https://hh.ru/vacancy/99606180,Гринатом,"{'id': 'remote', 'name': 'Удаленная работа'}",False,"Программист, разработчик",От 1 года до 3 лет,Полная занятость,null,null,Навыки проектирования и разработки DWH. Навыки проектирования и разработки ELT/<highlighttext>ETL</highlighttext>. Навыки проектирования и <highlighttext>разработки</highlighttext> интеграции с внешними системами (SAP...,"Разработка DWH, ELT/<highlighttext>ETL</highlighttext>. <highlighttext>Разработка</highlighttext> интеграционных потоков данных. Оптимизация производительности. Проведение тестирования. Оформление проектной документации. Выбор инструментов для решения технических..."
Разработчик ETL-процессов,False,Москва,2024-06-19 19:27,null,https://hh.ru/vacancy/102305281,АНО Университет Национальной Технологической Инициативы 2035,"{'id': 'fullDay', 'name': 'Полный день'}",False,"Программист, разработчик",От 1 года до 3 лет,Полная занятость,,200000,Опыт написания скриптов для загрузки данных из новых источников. Понимание принципов и методологии <highlighttext>ETL</highlighttext>-<highlighttext>разработки</highlighttext>. Опыт разработки ETL процессов. ,"Проектирование потоков данных. Загрузка и выгрузка данных скриптами SQL, Python. Поиск и устранение проблем в процессах обработки данных. "
Аналитик BI,False,null,2024-07-07 09:48,null,https://hh.ru/vacancy/96387673,Гринатом,"{'id': 'fullDay', 'name': 'Полный день'}",False,"BI-аналитик, аналитик данных",От 3 до 6 лет,Полная занятость,null,null,"Навыки проектирования и разработки BI/DWH/<highlighttext>ETL</highlighttext>. Навыки проектирования и <highlighttext>разработки</highlighttext> интеграции с внешними системами (SAP ERP, 1C ERP...","Уточнение требований. Проектирование. Разработка. Тестирование. Опытная, промышленная эксплуатация."
Разработчик хранилищ данных / DWH-разработчик,False,null,2024-07-02 12:54,null,https://hh.ru/vacancy/103130722,БиАйЭй-Технолоджиз,"{'id': 'fullDay', 'name': 'Полный день'}",False,"Программист, разработчик",От 3 до 6 лет,Полная занятость,null,null,Высшее техническое образование. Опыт работы в сфере ИТ и построения КХД / DWH более 2 лет. Опыт разработки SSIS пакетов от...,"Разработка интеграций, выбор структуры хранения данных в соответствии с требованиями, формирование диаграмм данных при необходимости, обсуждение структуры данных с заинтересованными..."
