name,has_test,address,created_at,insider_interview,alternate_url,employer,schedule,accept_temporary,professional_roles,experience,employment,salary_from,salary_to,requirement,responsibility
Инженер данных,False,Москва,2024-06-18 18:24,null,https://hh.ru/vacancy/102217664,Lion Recruitment,"{'id': 'flexible', 'name': 'Гибкий график'}",False,"BI-аналитик, аналитик данных",От 3 до 6 лет,Полная занятость,270000,350000,Понимание принципов проектирования архитектуры хранилищ данных DWH (<highlighttext>Data</highlighttext> vault/Inmon/Kimball). Опыт проектирования и разработки хранилищ данных от 2 лет. ,"Загрузка данных из различных источников (внутренние БД, файловые хранилища, API, web-ресурсы) в единое хранилище. Автоматизация <highlighttext>data</highlighttext>-pipelines, ETL процессов..."
С / Embedded Linux Engineer,False,null,2024-06-27 18:58,null,https://hh.ru/vacancy/102876324,TQB Russia,"{'id': 'fullDay', 'name': 'Полный день'}",False,"Программист, разработчик",Более 6 лет,Полная занятость,400000,,Коммерческий опыт разработки на С от 4 лет. Знание принципов построения сетевых инфраструктур и функционирования использующихся в них протоколах (Ethernet...,"Проектировать и воплощать в коде функции блока аппаратной абстракции, обеспечивающего программирование состояния передающего уровня (<highlighttext>Data</highlighttext> Plane) Ethernet и IP в..."
Дата инженер (удаленно),False,Москва,2024-07-09 14:27,null,https://hh.ru/vacancy/101836753,Лэтуаль Диджитал,"{'id': 'fullDay', 'name': 'Полный день'}",False,Аналитик,От 3 до 6 лет,Полная занятость,300000,400000,"...и технологий <highlighttext>Data</highlighttext> management, DWH/BI, Big <highlighttext>Data</highlighttext> и <highlighttext>Data</highlighttext> streaming. Понимание смежных технологических областей (инфраструктура, DevOps, DevSecops, <highlighttext>Data</highlighttext> Science...","Участвовать в проектировании, внедрении и развитии каталога данных. Участвовать в развитии процессов <highlighttext>Data</highlighttext> Governance. Документировать свою работу в JIRA/Confluence."
ML-инженер,False,null,2024-06-28 13:23,null,https://hh.ru/vacancy/102922265,Сапсан,"{'id': 'fullDay', 'name': 'Полный день'}",False,"Программист, разработчик",От 1 года до 3 лет,Полная занятость,,200000,Знание Python и фреймворков для машинного обучения. - Желательно знакомство с llamaindex и langchain. - Опыт работы в командах более одного года.,"Реализация различных сценариев <highlighttext>data</highlighttext> retrieval из документов с применением генеративных моделей (RAG-архитектура, выбор и до-обучение моделей), разработка OCR..."
Data Scientist,False,null,2024-07-10 21:35,null,https://hh.ru/vacancy/103676631,"Алабуга, ОЭЗ ППТ","{'id': 'fullDay', 'name': 'Полный день'}",False,Дата-сайентист,От 1 года до 3 лет,Полная занятость,160000,320000,Высшее техническое образование. От года опыта работы по специальности. Знания и опыт работы с алгоритмами классического машинного обучения. ,Разработка с нуля пайплайнов машинного обучения. Взаимодействие с <highlighttext>инженерами</highlighttext>-разработчиками для развертывания моделей в производственной среде компании. Взаимодействие с бизнес...
"NLP, LLM Data Scientist (удаленка)",False,null,2024-06-19 20:58,null,https://hh.ru/vacancy/102307647,СБЕР,"{'id': 'fullDay', 'name': 'Полный день'}",False,Аналитик,От 1 года до 3 лет,Полная занятость,null,null,Опыт в разработке NLP-моделей (обязательно) и рекомендательных систем (желательно). Высокий уровень владения ядром Python и SQL. Свободное владение базовыми...,Консультирование / участие в автоматизации источников данных для ML моделей совместно с ML <highlighttext>Engineer</highlighttext>/<highlighttext>Data</highlighttext> <highlighttext>Engineer</highlighttext>. End2end-разработка ML...
Junior ML-engineer (Data Scientist),False,Москва,2024-07-11 10:53,null,https://hh.ru/vacancy/99680706,АйТи Тех,"{'id': 'remote', 'name': 'Удаленная работа'}",False,Дата-сайентист,От 1 года до 3 лет,Полная занятость,null,null,"Участие в соревнованиях Kaggle. Опыт разработки open-source инструментов по ML. Навыки в разработке, дизайне и имплементации <highlighttext>data</highlighttext> mining моделей...",Баумана и др.. Вместе разбираем соревнования по <highlighttext>Data</highlighttext> Science (на команду - 42 медали Kaggle). Управления жизненным циклом ML. 
Инженер по машинному обучению (Исследователь в области сигналов),False,null,2024-07-11 11:52,null,https://hh.ru/vacancy/103123109,Open Media,"{'id': 'fullDay', 'name': 'Полный день'}",False,"Программист, разработчик",От 1 года до 3 лет,Полная занятость,null,null,"Способность работать в группе <highlighttext>инженеров</highlighttext> по ML и в сотрудничестве с другими командами (владельцами продукта, платформенными <highlighttext>инженерами</highlighttext>, DevOps, дизайнерами UI...",Обрабатывать наборы данных и организовывать соответствующие данные. Тесно сотрудничать с другими исследователями и <highlighttext>инженерами</highlighttext> по ML. Проводить код-ревью и...
Тестировщик хранилища данных,True,Москва,2024-07-02 12:52,null,https://hh.ru/vacancy/95188388,Синхро,"{'id': 'remote', 'name': 'Удаленная работа'}",False,Тестировщик,От 1 года до 3 лет,Полная занятость,null,null,Высшее образование. Приветствуется продолжительная работа на проектах. Знание Oracle PL/SQL - написание и понимание запросов на уровне хранимых процедур. ,Тестирование Хранилища данных (<highlighttext>Data</highlighttext> Warehouse) и отчётности. Составление тестовой документации и наполнение базы знаний. Оптимизация процессов контроля качества. 
BI Analyst,False,null,2024-06-21 07:07,null,https://hh.ru/vacancy/102399637,Финтех,"{'id': 'remote', 'name': 'Удаленная работа'}",False,Аналитик,От 1 года до 3 лет,Полная занятость,null,null,"Экспертное владение SQL: представления, вложенные запросы, обобщенные табличные выражения (СТЕ), оконные функции, джойны и группировки, планы запросов. Обязателен опыт работы...","Постановка задач <highlighttext>Data</highlighttext> <highlighttext>engineers</highlighttext> и product owners на предоставление данных из систем, а также создание витрин данных и агрегатов. "
Data Scientist (NLP\LLM),False,null,2024-06-26 12:47,null,https://hh.ru/vacancy/98005487,IT-компания Lad,"{'id': 'fullDay', 'name': 'Полный день'}",False,Дата-сайентист,От 1 года до 3 лет,Полная занятость,null,null,Умение реализовать RAG-LLM систему в том числе для offline решений. Умение обучать LoRA адаптеры для LLM. Умение формировать датасеты...,"Разработка решений в области ИИ: обработка естественного языка, виртуальные онлайн-консультанты и рекомендательно-аналитические системы, системы поддержки принятия решений, распознавание..."
Специалист по оценке [Junior],False,null,2024-07-01 10:16,null,https://hh.ru/vacancy/101361731,Диплей,"{'id': 'remote', 'name': 'Удаленная работа'}",False,Другое,От 1 года до 3 лет,Полная занятость,null,null,"Желание развиваться в сфере HR и помогать развиваться другим. Умение выстраивать коммуникации с самыми разными людьми, эмпатия, проактивная позиция. ",Участвовать во внедрении системы оценки и развития в ИТ. Организовывать и администрировать оценочные мероприятия (оценка компетенций/результативности и др.) на...
Quantitative Data Scientist,False,Москва,2024-06-24 10:37,null,https://hh.ru/vacancy/100627458,Банк ВТБ (ПАО),"{'id': 'fullDay', 'name': 'Полный день'}",False,Дата-сайентист,От 1 года до 3 лет,Полная занятость,null,null,"Ты выпускник ведущего технического и/или финансового ВУЗа. Приветствуется наличие научной степени, престижного сертификата дополнительного образования в области финансовой математики...","...одного проекта, в том числе с заказчиками. Нам важно умение говорить с системными аналитиками, дата <highlighttext>инженерами</highlighttext>, архитекторами, ML-Ops, бизнесом."
Support Engineer \ Специалист технической поддержки,False,null,2024-07-05 10:59,null,https://hh.ru/vacancy/103348108,Software Country (ТОО Балхаш Системс),"{'id': 'remote', 'name': 'Удаленная работа'}",False,Специалист технической поддержки,От 1 года до 3 лет,Полная занятость,null,null,"Опыт работы с Graylog, MS Application Insights, Azure Monitor Logs, Azure <highlighttext>Data</highlighttext> Explorer или другими системами логирования и мониторинга. ",Консультировать и технически поддерживать заказчика и партнеров через систему заявок (service desk). Анализировать поступившие данные и работать с БД. 
Data Engineer (junior),False,Владивосток,2024-07-09 03:09,null,https://hh.ru/vacancy/98512998,DNS Технологии,"{'id': 'fullDay', 'name': 'Полный день'}",False,Другое,Нет опыта,Полная занятость,70000,,"Владение SQL (clickhouse, postgresql) на базовом уровне. Владение Python. Практический опыт работы с БД. Навык разработки и автоматизация ETL-процессов.","Анализ новых источников данных, настройка процесса загрузки данных в <highlighttext>Data</highlighttext> Lake. Интеграция новых источников данных. Автоматизация мониторинга качества витрин данных."
NLP Data Scientist,False,null,2024-06-19 20:53,null,https://hh.ru/vacancy/102307595,СБЕР,"{'id': 'fullDay', 'name': 'Полный день'}",False,Дата-сайентист,От 1 года до 3 лет,Полная занятость,null,null,1. Опыт работы на позиции DS NLP / NLP Researcher / DS Researcher от 1 года. 2. Опыт применения современных DL-подходов...,3. Взаимодействие с <highlighttext>инженерами</highlighttext>-разработчиками для развертывания моделей в производственной среде компании. Взаимодействие с бизнес-заказчиками для уточнения деталей и...
Data Scientist,False,Москва,2024-07-10 13:28,null,https://hh.ru/vacancy/89237775,Вкусно — и точка,"{'id': 'fullDay', 'name': 'Полный день'}",False,"BI-аналитик, аналитик данных",От 1 года до 3 лет,Полная занятость,null,null,"Опыт в ML от 2 лет. Понимание принципа работы основных алгоритмов классического ML (классификации, кластеризации, регрессии, временные ряды). ","Работа с данными (очистка данных, исследование, feature <highlighttext>engineering</highlighttext>). Выдвижение и проверка гипотез. Обсуждение задачи с бизнес заказчиками. Разработка прогнозных моделей..."
IT Analyst,False,Moscow,2024-06-27 17:41,null,https://hh.ru/vacancy/102873004,BMW,"{'id': 'fullDay', 'name': 'Полный день'}",False,"BI-аналитик, аналитик данных",От 1 года до 3 лет,Полная занятость,null,null,Work experience as analyst (Power BI or QlikSense or other BI tool). Good knowledge of SQL (Postgre or MS SQL). ,"Ensure functional maintenance support and application operations according to the business requirements. Developing BI Reports, <highlighttext>data</highlighttext> pipelines and applications functional..."
Product Manager IoT,False,null,2024-07-01 16:18,null,https://hh.ru/vacancy/103066359,"DODO BRANDS (Dodo Pizza, Drinkit)","{'id': 'fullDay', 'name': 'Полный день'}",False,Менеджер продукта,От 1 года до 3 лет,Полная занятость,null,null,Есть опыт работы с Hardware устройствами или IOT. Умеешь определять потребности разных сегментов пользователей продукта и предлагать решения. ,"Вместе с продуктовым аналитиком улучшить работу с метриками и построить <highlighttext>data</highlighttext> informed подход. Взаимодействовать со стейкхолдерами, выделенными командами разработки, дизайнерами..."
"Middle / Senior ML Engineer (Python), удаленно",False,null,2024-07-11 13:54,null,https://hh.ru/vacancy/103714051,RedLab,"{'id': 'remote', 'name': 'Удаленная работа'}",True,"Программист, разработчик",От 3 до 6 лет,Полная занятость,null,null,"Опыт работы с GPT и NLP. Уверенное знание <highlighttext>data</highlighttext> science stack (numpy, scipy, scikit-learn, pandas и др.). ",
Middle Data Engineer,False,null,2024-07-11 07:26,null,https://hh.ru/vacancy/103681840,FESCO (ПАО Дальневосточное морское пароходство),"{'id': 'remote', 'name': 'Удаленная работа'}",False,Дата-сайентист,От 3 до 6 лет,Полная занятость,240000,,"Понимание подходов к организации процессов разработки (CI/CD, DevOps). Понимание принципов <highlighttext>data</highlighttext> governance, основ управления качеством данных, подхода ""данные, как...","Изучение текущей инфраструктуры и оптимизация сбора и обработки данных, поступающих из различных источников. Проектирование архитектуры хранилища. Реализация, организация и поддержка..."
Data Engineer,False,null,2024-07-01 20:22,null,https://hh.ru/vacancy/103080324,Т1,"{'id': 'fullDay', 'name': 'Полный день'}",False,Дата-сайентист,От 3 до 6 лет,Полная занятость,null,null,"...частности с Teradata. Опыт проведения анализа данных с помощью Python. Опыт работы с Big <highlighttext>data</highlighttext> стеком: Hadoop, Hive, PySpark, Airflow.","Анализ, проектирование и создание витрин данных. Извлечение, очистка, загрузка и трансформация больших объемов данных из различных источников (тeradata, hadoop, плоские..."
Data Scientist (Ранжирование),False,null,2024-06-26 15:30,null,https://hh.ru/vacancy/102784490,WILDBERRIES,"{'id': 'fullDay', 'name': 'Полный день'}",False,Дата-сайентист,От 1 года до 3 лет,Полная занятость,null,null,"Опыт работы с различными типами моделей машинного обучения. Опыт работы с рекомендательными системами, NLP. Отличные знания Python и основных библиотек...","Разработка, обучение и масштабирование моделей машинного обучения для ранжирования. Проектирование архитектуры ML-сервисов. Разработка метрик качества работы ML-сервисов."
Python разработчик (ОФИС),False,Екатеринбург,2024-07-08 08:58,null,https://hh.ru/vacancy/101741848,SpectrumData,"{'id': 'fullDay', 'name': 'Полный день'}",False,"Программист, разработчик",От 1 года до 3 лет,Полная занятость,150000,250000,Уже имеете опыт работы со Spark и Polars.,"SpectrumData – IT-компания, предоставляющая решения в области Big <highlighttext>Data</highlighttext> и <highlighttext>Data</highlighttext> Mining на основе данных о людях, организациях, автомобилях и..."
Data Analyst (Команда Управления Комплаенс),False,null,2024-06-26 09:05,null,https://hh.ru/vacancy/100301503,СБЕР,"{'id': 'fullDay', 'name': 'Полный день'}",False,"BI-аналитик, аналитик данных",От 3 до 6 лет,Полная занятость,null,null,"Профильное высшее образование, опыт работы в области анализа данных не менее года. Опыт работы с базами данных (SQL). ",Разработка стратегий принятия решений в области Комплаенс риска. Изучение выявления схем легализации и формирование предложений по их изменению и автоматизации. 
Lead Stream Software Engineer (ReactJS) - [FinTech],False,null,2024-06-25 11:24,null,https://hh.ru/vacancy/102664876,Sibdev,"{'id': 'remote', 'name': 'Удаленная работа'}",False,Руководитель группы разработки,От 3 до 6 лет,Полная занятость,5000,7000,4+ years Next.js and ReactJS. 1+ year experience managing team of 3+ developers. Experience in integrating front...,"Integrate PayloadCMS into the application, setting up content models, custom fields, and managing <highlighttext>data</highlighttext>. Integrate front-end components with backend..."
Data-инженер в банк,False,null,2024-07-09 07:41,null,https://hh.ru/vacancy/103552242,VeryIT,"{'id': 'remote', 'name': 'Удаленная работа'}",False,Другое,От 3 до 6 лет,Полная занятость,290000,,Опыт работы с хранилищами данных и с отчетностью в АБС Банка. Понимание жизненного цикла разработки программного обеспечения. Желательно понимание процессов...,Анализ новых требований от заказчиков по задачам обязательной отчетности ( ЦБ). Реализация изменений и тестирование на стороне DWH. Взаимодействие с внутренними...
Data инженер (BI-среды),False,null,2024-06-18 16:25,"{'id': '32631', 'url': 'https://hh.ru/interview/32631?employerId=80'}",https://hh.ru/vacancy/102209666,Альфа-Банк,"{'id': 'fullDay', 'name': 'Полный день'}",False,"BI-аналитик, аналитик данных",От 1 года до 3 лет,Полная занятость,null,null,"Знание SQL (DML и DDL операции), понимание теории организации хранилищ данных. - Опыт работы с ETL-средствами, предпочтительно с Informatica. - ","Обеспечивать функциональное сопровождение ETL/ELT-процессов, включающее. - Мониторинг процессов. - Решение возникающих проблем при работе в сопровождаемых системах и связанным с..."
Менеджер по внутренним и внешним коммуникациям,False,null,2024-06-14 15:07,null,https://hh.ru/vacancy/101945610,СБЕР,"{'id': 'fullDay', 'name': 'Полный день'}",False,Другое,От 3 до 6 лет,Полная занятость,null,null,"Любите и умеете работать с людьми. Умеете объединять людей вокруг идеи, знаете, как помочь участникам сообщества раскрыть свой потенциал. ","Организовывать работу сообщества D-people (<highlighttext>Data</highlighttext> Analytics, <highlighttext>Data</highlighttext> <highlighttext>Engineers</highlighttext>, <highlighttext>Data</highlighttext> Scientists, специалисты RecSys). Ведение новостного канала, привлечение и работа со..."
ETL-разработчик (Data Engineer),False,null,2024-07-03 16:24,null,https://hh.ru/vacancy/81864083,СберСпасибо,"{'id': 'fullDay', 'name': 'Полный день'}",False,"Программист, разработчик",От 1 года до 3 лет,Полная занятость,null,null,"Уверенные знания Python и SQL. Опыт работы с: Промышленными ETL (DBT как преимущество, SAS DI, Informatica, ODI, DataStage). ",Настроить пайплайн автоматической проверки качества данных. Написать скрипты для загрузки новых источников. Создать витрины для команды розницы и product analysis. 
