name,has_test,address,created_at,insider_interview,alternate_url,employer,schedule,accept_temporary,professional_roles,experience,employment,salary_from,salary_to,requirement,responsibility
Data Engineer (Поиск),False,null,2024-07-09 11:29,null,https://hh.ru/vacancy/102770778,WILDBERRIES,"{'id': 'fullDay', 'name': 'Полный день'}",False,Аналитик,От 1 года до 3 лет,Полная занятость,null,null,"уверенное владение Python, SQL, Airflow. - опыт работы с БД: SQL (PostgreSQL, Greenplum, Clickhouse) / NoSQL. - опыт в моделировании данных. - ",разработка витрин данных для аналитиков: сбор требований и реализация. - автоматизация контроля качества и полноты данных. - интеграция новых источников данных. - 
Data Engineer (GreenPlum),False,null,2024-06-13 13:35,null,https://hh.ru/vacancy/98926253,X5 Digital,"{'id': 'remote', 'name': 'Удаленная работа'}",False,"Программист, разработчик",От 3 до 6 лет,Полная занятость,null,null,"Технологии с которыми работаем: Greenplum, DBT, Python, Airflow, ClickHouse, Docker, Bash, PostgreSQL. Пожелания к твоему опыту: Опыт работы с GreenPlum. ","Работой с данными, проверкой качества данных, построением витрин данных. Разработкой ETL процедур. Построением аналитических витрин данных на GreenPlum. "
Data engineer,False,null,2024-06-17 08:16,null,https://hh.ru/vacancy/99071111,Лига Цифровой Экономики,"{'id': 'fullDay', 'name': 'Полный день'}",False,"Программист, разработчик",От 1 года до 3 лет,Полная занятость,null,null,Знания SQL на высоком уровне. Опыт промышленной разработки на реляционных СУБД (предпочтительно MPP). Опыт построения ETL потоков и разработки хранилищ...,Развитие хранилища данных на основе Hadoop. Разработка и изменение витрин данных на Hadoop исходя из требований. Создание алгоритмов загрузки данных...
Data Engineer / Data-инженер (WMS),False,null,2024-06-17 13:37,null,https://hh.ru/vacancy/102100974,WILDBERRIES,"{'id': 'fullDay', 'name': 'Полный день'}",True,"BI-аналитик, аналитик данных",От 1 года до 3 лет,Полная занятость,null,null,"Умение оптимизировать запросы. Обязательно опыт работы с ClickHouse, Kafka/<highlighttext>data</highlighttext> streaming, Debezium, Hadoop, Spark. Опыт работы с Apache airflow и...","Проектирование структур хранилищ данных (DWH). Создание и доработка ETL процессов загрузки, трансформации данных и формирования витрин (ETL). Разработка и модернизация..."
Аналитик,False,null,2024-07-03 08:55,null,https://hh.ru/vacancy/101065322,True Engineering,"{'id': 'fullDay', 'name': 'Полный день'}",False,Аналитик,От 1 года до 3 лет,Полная занятость,null,null,"Понимание процессов разработки ПО. Умение проводить оперативный комплексный анализ большого объема разнородной информации. Опыт моделирования, оптимизации бизнес-процессов. ","Анализ, выяснение и уточнение требований бизнеса. Анализ и документирование проектов/бизнес-процессов. Прототипирование пользовательских интерфейсов. Разработка технических заданий, регламентов, сценариев..."
Middle Data engineer,False,null,2024-06-17 08:42,null,https://hh.ru/vacancy/102058637,Лига Цифровой Экономики,"{'id': 'fullDay', 'name': 'Полный день'}",False,"Программист, разработчик",От 1 года до 3 лет,Полная занятость,null,null,"Знание одного из языков: Java, Python. Умение писать сложные SQL запросы с использованием аналитических функций. Опыт работы c NiFi. ",Проектировать и разрабатывать ETL-процессы. Проводить загрузку данных из различных источников. Формировать staging и detailed слоёв.
Data Engineer [NUUM],False,null,2024-07-08 14:17,null,https://hh.ru/vacancy/103508270,МТС,"{'id': 'fullDay', 'name': 'Полный день'}",False,"Программист, разработчик",От 3 до 6 лет,Полная занятость,null,null,"Опыт работы с базами данных, умение писать сложные запросы, опыт создания дашбордов. Опыт обработки и структурирования. Опыт работы с DWH...","Формировать отчеты, аналитические справки и презентации для продуктовой аналитики. Оптимизировать и поддерживать существующие ETL-процессы. Извлечение, преобразование, загрузка данных и..."
Руководитель Департамента по работе с данными,False,Москва,2024-07-01 13:09,null,https://hh.ru/vacancy/98917598,Faberlic,"{'id': 'fullDay', 'name': 'Полный день'}",False,Дата-сайентист,От 3 до 6 лет,Полная занятость,null,null,"Опыт разработки и внедрения процессов Управления Данными (<highlighttext>Data</highlighttext> Governance) . Знание технологий, связанных с Big <highlighttext>Data</highlighttext> (DWH, ETL, BI, DataLake). ","...решений по работе с данными (Бизнес-аналитика, BI, DWH, <highlighttext>Data</highlighttext> <highlighttext>Engineer</highlighttext>, <highlighttext>Data</highlighttext> Science ). Управлением бюджетом, его подготовка в рамках своей..."
Data engineer,False,null,2024-06-27 14:53,null,https://hh.ru/vacancy/102858813,МегаФон,"{'id': 'fullDay', 'name': 'Полный день'}",False,"Программист, разработчик",От 1 года до 3 лет,Полная занятость,null,null,"Наши преимущества: Опыт работы с большими данными: HDFS, PySpark от 1 года. Опыт работы с Python, в том числе с...",Разрабатывать отчетность с использованием скриптов на PySpark. Генерировать новые признаки для ML-моделей.
Инженер по работе с выгрузками данных,False,Екатеринбург,2024-07-11 09:39,null,https://hh.ru/vacancy/98004649,SpectrumData,"{'id': 'fullDay', 'name': 'Полный день'}",False,Аналитик,От 1 года до 3 лет,Полная занятость,70000,,"Отличный уровень владения Excel, знание EmEditor, PowerQuery. Умение работать с Git, опыт работы с трекинговыми системами. Опыт анализа, очистки больших...","Выгрузка данных из БД и внутренней системы. Приведение выгружаемых данных к стандартному формату. Анализ требований к обогащению выгружаемых данных, приходящий..."
Data engineer в Финтех,False,null,2024-07-10 18:42,null,https://hh.ru/vacancy/103673832,Яндекс,"{'id': 'fullDay', 'name': 'Полный день'}",False,"Программист, разработчик",От 3 до 6 лет,Полная занятость,null,null,,"Работать с базами данных SQL и NoSQL, масштабировать и шардировать их. Обрабатывать массивы данных с учётом eventual consistency и других..."
ГИС-аналитик,False,null,2024-07-08 17:50,null,https://hh.ru/vacancy/103531343,"Алабуга, ОЭЗ ППТ","{'id': 'fullDay', 'name': 'Полный день'}",False,Геодезист,От 1 года до 3 лет,Полная занятость,,300000,"Знания QGIS, ArcGIS, Earth <highlighttext>Engine</highlighttext>. Python, SQL, PostgreSQL, JavaScript, Big <highlighttext>Data</highlighttext>, Машинное обучение. Патриот. Коммуникабельный. Быстро обучаемый. Обязательный профильный опыт...",Создание нейросетевых моделей семантической сегментации объектов. Анализ динамики и визуализация данных на основе космической съемки. Разработка геоинформационных систем и прикладного...
Data engineer в Яндекс Лавку,False,,2024-07-09 11:41,null,https://hh.ru/vacancy/103577028,Яндекс,"{'id': 'fullDay', 'name': 'Полный день'}",False,"Программист, разработчик",От 3 до 6 лет,Полная занятость,null,null,Уверенно программируете на Python. Хорошо знаете SQL и понимаете устройство современных реляционных баз данных. Разбираетесь в классических алгоритмах и структурах...,Работа с данными. Вам предстоит оптимизировать нетривиальные ETL-процессы обработки больших данных и работать с данными на каждом этапе их...
ГИС-аналитик,False,null,2024-07-08 17:50,null,https://hh.ru/vacancy/103531345,"Алабуга, ОЭЗ ППТ","{'id': 'fullDay', 'name': 'Полный день'}",False,Геодезист,От 1 года до 3 лет,Полная занятость,,300000,"Знания QGIS, ArcGIS, Earth <highlighttext>Engine</highlighttext>. Python, SQL, PostgreSQL, JavaScript, Big <highlighttext>Data</highlighttext>, Машинное обучение. Патриот. Коммуникабельный. Быстро обучаемый. Обязательный профильный опыт...",Создание нейросетевых моделей семантической сегментации объектов. Анализ динамики и визуализация данных на основе космической съемки. Разработка геоинформационных систем и прикладного...
Data Engineer/Дата инженер (Ведущий специалист по информационным технологиям),False,,2024-06-14 15:18,null,https://hh.ru/vacancy/99062805,Пивоваренная компания Балтика,"{'id': 'fullDay', 'name': 'Полный день'}",False,Аналитик,От 1 года до 3 лет,Полная занятость,null,null,"Высшее образование (техническое, информационные технологии). Опыт написание хранимых процедур (Microsoft SQL Server, PostgreSQL). Знание и опыт использования технологий OLAP. ","Разработка ETL/ELT для корпоративного хранилища данных. Построение витрин данных. Участие в разработке архитектуры, проектировании технологических решений в рамках КХД. "
Инженер по машинному обучению (Machine Learning Engineer),False,Москва,2024-07-02 11:55,null,https://hh.ru/vacancy/103123600,ГЛОРИЯ ДЖИНС,"{'id': 'fullDay', 'name': 'Полный день'}",False,Дата-сайентист,От 3 до 6 лет,Полная занятость,null,null,"Степень бакалавра или магистра в области компьютерных наук, <highlighttext>Data</highlighttext> Science или смежной области. 3+ года опыта работы в области...","Разработка моделей: Проектировать, разрабатывать и внедрять модели машинного обучения, используя различные методы (например, обучение с учителем, без учителя, обучение с..."
Data Engineer / Data scientist Middle/Senior,False,Пермь,2024-07-10 12:47,null,https://hh.ru/vacancy/103646831,DIGITAL FUTURE SYSTEMS,"{'id': 'remote', 'name': 'Удаленная работа'}",False,Дата-сайентист,От 1 года до 3 лет,Полная занятость,null,null,"Знание Python. Знание методов и принципов машинного обучения. Понимание принципов работы языковых моделей, опыт работы с ними.","Разработка алгоритмов загрузки, подготовки и обработки данных для последующих аналитических задач. Применение уже обученных моделей для решения прикладных задач, дообучение..."
Специалист по цифровым технологиям аудита,False,null,2024-06-19 20:13,null,https://hh.ru/vacancy/102306584,СБЕР,"{'id': 'fullDay', 'name': 'Полный день'}",False,Аудитор,Нет опыта,Полная занятость,null,null,Имеешь оконченное высшее образование или студент старших курсов. Можешь обрабатывать данные с помощью SQL или Excel/PowerQuery. Хочешь развить знания...,Исследовать и анализировать большие неструктурированные объемы информации. Участвовать в аудиторских проверках по всем направлениям работы Сбера. Подготавливать рекомендации по улучшению...
IT Recruiter,False,Москва,2024-07-03 11:18,null,https://hh.ru/vacancy/98023224,WILDBERRIES,"{'id': 'fullDay', 'name': 'Полный день'}",False,Менеджер по персоналу,От 3 до 6 лет,Полная занятость,null,null,,"Своя инфраструктура, автоматизация внутренних процессов организации работы, а так же блоков сопровождения и поддержки. Повторно встретимся и обсудим несклько рабочих..."
Data Analyst/Data Engineer,False,null,2024-07-08 10:27,null,https://hh.ru/vacancy/97353345,СБЕР,"{'id': 'fullDay', 'name': 'Полный день'}",False,"Программист, разработчик",От 1 года до 3 лет,Полная занятость,null,null,"Умеешь анализировать данные, работать с большим количеством источников данных. Самостоятелен: гуглишь, думаешь, пробуешь решить проблему, спрашиваешь, решаешь. Готов быстро осваивать...","Проводить анализ источников данных в Hadoop, GreenPlum для реализации задач. Формировать запросы для создания персональных предложений. Управлять и поддерживать формирование..."
Senior Data Scientist NLP в команду клиентского сервиса,False,null,2024-06-18 14:36,null,https://hh.ru/vacancy/97662522,Газпромбанк,"{'id': 'fullDay', 'name': 'Полный день'}",False,Дата-сайентист,От 3 до 6 лет,Полная занятость,null,null,"Занимались дообучением BERT-Like и GPT-Like моделей. Работали с LLM, prompt <highlighttext>engineering</highlighttext>. Программируете на Python, R или подобных языках...","Проектировать, разрабатывать и внедрять LLM модели, участвовать в разработке pipeline до промышленной реализации. Создавать генеративные модели, чат-боты. "
Data Engineer в команду CRM,False,Москва,2024-06-24 13:46,null,https://hh.ru/vacancy/96071948,Циан,"{'id': 'remote', 'name': 'Удаленная работа'}",False,Другое,От 3 до 6 лет,Полная занятость,null,null,Имеет опыт работы с Hadoop стеком от 2 лет и потоковыми вычислениями (Spark Streaming в приоритете). Есть верхнеуровневое понимание Hadoop...,"Работал с Kafka, Airflow."
Data Scientist,False,null,2024-07-10 21:35,null,https://hh.ru/vacancy/103676633,"Алабуга, ОЭЗ ППТ","{'id': 'fullDay', 'name': 'Полный день'}",False,Дата-сайентист,От 1 года до 3 лет,Полная занятость,160000,320000,Высшее техническое образование. От года опыта работы по специальности. Знания и опыт работы с алгоритмами классического машинного обучения. ,Разработка с нуля пайплайнов машинного обучения. Взаимодействие с <highlighttext>инженерами</highlighttext>-разработчиками для развертывания моделей в производственной среде компании. Взаимодействие с бизнес...
Data Engineer (Дата Инженер),False,Москва,2024-07-05 09:55,null,https://hh.ru/vacancy/94348279,Лига Цифровой Экономики,"{'id': 'fullDay', 'name': 'Полный день'}",False,"Программист, разработчик",От 1 года до 3 лет,Полная занятость,null,null,"Опыт разработки java/scala от 1 года. SQL на уровне написания простых запросов. Hadoop (hdfs, hive, yarn). Базовые знания Spark. ","Построение пайплайнов, Парсинг данных, обогащение данных (Kafka, Nifi, Flink, Hive) по шаблонам. Участие в Agile-церемониях. Участие в выводе и..."
Data Engineer,False,null,2024-06-27 12:38,null,https://hh.ru/vacancy/102845987,СДЭК,"{'id': 'remote', 'name': 'Удаленная работа'}",False,Другое,От 1 года до 3 лет,Полная занятость,null,null,...знание подходов к проектированию хранилища данных / озера данных. Опыт работы с Greenplum / Clickhouse. Опыт работы с Airflow. Знание <highlighttext>Data</highlighttext> quality.,"...данных, автоматизировать проверку качества данных. Настроить <highlighttext>Data</highlighttext> Quality проверки и мониторинг процессов обработки данных. Автоматизировать <highlighttext>data</highlighttext>-pipelines и ETL процессы."
Data engineer,False,Санкт-Петербург,2024-06-18 13:08,null,https://hh.ru/vacancy/102187434,Совкомбанк,"{'id': 'fullDay', 'name': 'Полный день'}",False,"Программист, разработчик",От 1 года до 3 лет,Полная занятость,null,null,"Хорошие знания SQL, опыт работы с одной из реляционной БД - MS SQL/PostgreSQL/Oracle в качестве разработчика. Навыки проектирования реляционных...","Построение ETL процессов, решение задач по организации сбора данных из различных источников в DWH. Разработка и автоматизация процессов преобразования данных..."
"Junior Data Scientist в Дивизион ""Корпоративное взыскание""",False,null,2024-07-06 13:50,null,https://hh.ru/vacancy/103409668,СБЕР,"{'id': 'fullDay', 'name': 'Полный день'}",False,Аналитик,От 1 года до 3 лет,Полная занятость,null,null,"Опыт работы DS 3+ года (желательно опыт наставничества/руководства). Библиотеки: Pandas, Scikit-learn, Lightgbm, XGBoost, Catboost, Tensorflow (pytorch). ",Департамент по работе с проблемными активами помогает клиентам сделать выбор в трудной ситуации (особенно в текущей ситуации). Сотрудники департамента разрабатывают...
Data Engineer,False,null,2024-07-09 12:01,null,https://hh.ru/vacancy/103579080,Лига Цифровой Экономики,"{'id': 'fullDay', 'name': 'Полный день'}",False,"Программист, разработчик",От 1 года до 3 лет,Полная занятость,null,null,"Знакомство с СУБД DB2 или готовность её освоить. Опыт разработки SQL-запросов для одной из СУБД: MS SQL, Oracle...",Проект в банке ТОП-3 по разработке форм стандартизованной банковской отчётности на основе выделенного ODS в КХД. Твои задачи: Написание...
Data Engineer,False,Москва,2024-07-11 15:38,null,https://hh.ru/vacancy/103723376,eCredit,"{'id': 'flexible', 'name': 'Гибкий график'}",False,Дата-сайентист,От 1 года до 3 лет,Полная занятость,null,null,"Опыт участия в проектировании/внедрении хранилища данных с применением практик и технологий <highlighttext>Data</highlighttext> management, DWH/BI, Big <highlighttext>Data</highlighttext> и <highlighttext>Data</highlighttext>...","Выстраивать процессы взаимодействия DWH со всеми источниками данных, создавать и поддерживать ETL процессы (Apache Airflow). Проектировать модели данных детального слоя..."
Data Scientist (Deep Learning),False,null,2024-06-22 11:45,null,https://hh.ru/vacancy/97705931,Lamoda Tech,"{'id': 'fullDay', 'name': 'Полный день'}",False,Дата-сайентист,От 1 года до 3 лет,Полная занятость,null,null,"Опыт в области анализа данных и машинного обучения (от 2 лет). Опыт работы с SQL, Hadoop, Hive, Spark. ",Регулярно проводим командные брейнштормы с целью генерации новых идей по развитию наших <highlighttext>data</highlighttext>-driven продуктов. В компании внедрена культура принятия...
AI / ML Tech Lead,False,Москва,2024-07-10 12:05,null,https://hh.ru/vacancy/103643333,Voximplant,"{'id': 'remote', 'name': 'Удаленная работа'}",False,Руководитель группы разработки,Более 6 лет,Полная занятость,null,null,Уже имеете опыт работы тимлидом в продуктовом ML. Знакомы с актуальным стеком в DL NLP (pytorch / tf / transformers / LLM) и...,"Автоматизировать дата-интенсивные пайплайны по обновлению моделей, бороться с <highlighttext>data</highlighttext>/concept drift. Оптимизировать ML-решения под запросы бизнеса, строить каскады..."
